{
  "schema_version": "0.1",
  "workspace_id": "atlas",
  "unit_id": "atlas.domain",
  "observed_at": "2026-01-01T00:00:00Z",
  "status": "active",
  "summary": "Example domain-contract work.",
  "actors": [
    {
      "kind": "ai",
      "id": "ai.example"
    }
  ],
  "references": [
    {
      "kind": "issue",
      "id": "example-1",
      "label": "Synthetic work item"
    }
  ],
  "source": {
    "kind": "mcp",
    "ref": "schema-example"
  },
  "facets": []
}
